tmdb_id,imdb_id,title,original_title,tagline,overview,release_date,runtime_mins,certification,genres,keywords,spoken_languages,origin_country,collection,director,top_cast,production_companies,budget,revenue,vote_average,vote_count,popularity
522478,tt8376234,Peter Rabbit 2: The Runaway,Peter Rabbit 2: The Runaway,The garden was just the beginning.,"Peter Rabbit runs away from his human family when he learns they are going to portray him in a bad light in their book. Soon, he crosses paths with an older rabbit who ropes him into a heist.",2021-03-25,93,PG,Family|Comedy|Adventure,based on children's book|rabbit,English,AU,Peter Rabbit Collection,Will Gluck,James Corden|Rose Byrne|Domhnall Gleeson|David Oyelowo|Margot Robbie,Columbia Pictures|Olive Bridge Entertainment|Animal Logic|MRC|2.0 Entertainment,45000000,153000000,7.039,876,3.7553
4441,tt0424880,Candy,Candy,More is never enough.,"A poet falls in love with an art student, who gravitates to his bohemian lifestyle — and his love of heroin. Hooked as much on one another as they are on the drug, their relationship alternates between states of oblivion, self-destruction, and despair.",2006-05-25,116,R,Drama|Romance,australia|based on novel or book|heroin|junkie|methadone programme|artist|cold turkey|marriage|mental breakdown|lovers|drawing and painting|recovering addict,English,AU,,Neil Armfield,Abbie Cornish|Heath Ledger|Geoffrey Rush|Tom Budge|Roberto Meza-Mont,Paradigm Hyde Films|Film Finance Group|New South Wales Film & Television Office|Renaissance Films,0,2105096,7.129,634,3.4339
907,tt0059113,Doctor Zhivago,Doctor Zhivago,A Love Caught in the Fire of Revolution,"The life of a Russian physician and poet who, although married to another, falls in love with a political activist's wife and experiences hardship during World War I and then the October Revolution.",1965-12-22,200,PG-13,Drama|Romance|War,daughter|based on novel or book|love triangle|nurse|world war i|suicide attempt|loss of loved one|forbidden love|stepparents|russian revolution (1917)|1910s|dramatic|condescending|melodramatic|triangulo amoroso|metrocolor|suicídio|primeira guerra mundial|revolução russa,English|Russian,GB|US,,David Lean,Omar Sharif|Julie Christie|Geraldine Chaplin|Rod Steiger|Alec Guinness,Metro-Goldwyn-Mayer|Carlo Ponti Production,11000000,111858363,7.544,1252,3.2302
587496,tt10003008,The Rental,The Rental,Secluded getaway. Killer views.,"Two couples on an oceanside getaway grow suspicious that the host of their seemingly perfect rental house may be spying on them. Before long, what should have been a celebratory weekend trip turns into something far more sinister.",2020-07-23,88,R,Horror|Thriller,"portland, oregon|camera|ecstasy|stalker|murder|serial killer|voyeurism|handyman|airbnb|weekend getaway|mismatched couple|husband cheating on wife|wife cheating on husband",English,US,,Dave Franco,Dan Stevens|Alison Brie|Sheila Vand|Jeremy Allen White|Toby Huss,Black Bear Pictures|Ramona Films,3500000,4311042,5.547,973,3.4155
8007,tt0159273,Behind Enemy Lines,Behind Enemy Lines,His only weapon is his will to survive.,"While flying a routine reconnaissance mission over Bosnia, fighter pilot Lt. Chris Burnett photographs something he wasn't supposed to see and gets shot down behind enemy lines, where he must outrun an army led by a ruthless Serbian general. With time running out and a deadly tracker on his trail, Burnett's commanding officer, Admiral Reigart, decides to risk his career and launch a renegade rescue mission to save his life.",2001-11-30,106,PG-13,Action|Drama|Thriller|War,sniper|war crimes|bosnia and herzegovina|rescue mission|u.s. navy|based on true story|north atlantic treaty organization (nato)|naval officer|bosnian war (1992-95)|serbian|atrocity|combat|behind enemy lines|jet fighter pilot|mine field|hunted|jet crash|aircraft carrier|reconnaissance|mass grave|marines|enemy territory|naval flight officer|navy pilot|running for one's life|no fly zone,Czech|English|Spanish|Serbo-Croatian,US,Behind Enemy Lines Collection,John Moore,Owen Wilson|Gene Hackman|Gabriel Macht|Olek Krupa|Vladimir Mashkov,Davis Entertainment|20th Century Fox,40000000,91753202,6.416,1610,2.888
42661,tt0052365,The Vikings,The Vikings,Mightiest Of Men... Mightiest Of Spectacles... Mightiest Of Motion Pictures!,"Einar, brutal son of the viking Ragnar and future heir to his throne, tangles with clever slave Eric, for the hand of a beautiful English maiden.",1958-06-11,115,NR,Adventure|History|Action,based on novel or book|scandinavia|vikings (norsemen)|norway|unknown father|slave|swashbuckler|one eyed man|sailing ship|one armed man|british monarchy|northumberland|wolves|9th century|falconry|half-brothers|abducted fiancée|technirama,English,US,,Richard Fleischer,Kirk Douglas|Tony Curtis|Ernest Borgnine|Janet Leigh|James Donald,Brynaprod S.A.|Curtleigh Productions|United Artists,5000000,20311,7.014,362,3.2693
40619,tt1620446,Day & Night,Day & Night,,"When Day, a sunny fellow, encounters Night, a stranger of distinctly darker moods, sparks fly! Day and Night are frightened and suspicious of each other at first, and quickly get off on the wrong foot. But as they discover each other's unique qualities--and come to realize that each of them offers a different window onto the same world-the friendship helps both to gain a new perspective.",2010-06-17,6,G,Animation|Family|Comedy,short film,English,US,,Teddy Newton,Wayne Dyer,Walt Disney Pictures|Pixar,0,0,7.709,939,3.2573
10784,tt0068327,Cabaret,Cabaret,Life is a Cabaret.,"Inside the Kit Kat Club of 1931 Berlin, starry-eyed singer Sally Bowles and an impish emcee sound the clarion call to decadent fun, while outside a certain political party grows into a brutal force.",1972-02-13,124,PG,Music|Drama|Romance,"berlin, germany|nazi|entertainer|cabaret|bisexuality|musical|based on play or musical|hitler youth|fireplace|based on short story|lgbt|baron love|political unrest|english lesson|1930s|gay theme",Hebrew|German|French|English,US,,Bob Fosse,Liza Minnelli|Michael York|Helmut Griem|Joel Grey|Fritz Wepper,Allied Artists Pictures|ABC Pictures|Bavaria Film,4600000,42800000,7.427,959,3.2656
13012,tt1117385,Felon,Felon,No rule. No hope. No way out.,A family man convicted of killing an intruder must cope with life afterward in the violent penal system.,2008-07-17,103,R,Crime|Drama|Thriller|Action,prison|neo-nazism|tattoo|court|fight|murder|inmate|break in|prison riot|tear gas|san quentin|aryan,English,US,,Ric Roman Waugh,Stephen Dorff|Val Kilmer|Harold Perrineau|Marisol Nichols|Johnny Lewis,Pantry Films|Stage 6 Films|Tooley Productions,2900000,0,7.144,956,2.9304
9395,tt0094602,Above the Law,Above the Law,He's a cop who believes no one is above the law.,"Nico Toscani is an Italian immigrant, American patriot, ex-CIA agent, aikido specialist and unorthodox Chicago policeman. He is as committed to his job as he is to his personalized brand of justice—expert and thorough bone-crushing.",1988-04-08,99,R,Action|Crime|Drama|Mystery|Thriller,"chicago, illinois|martial arts|vietnam|central intelligence agency (cia)|corruption|senator|cop|torture|drug lord",English|Spanish,US,,Andrew Davis,Steven Seagal|Pam Grier|Henry Silva|Sharon Stone|Ron Dean,Warner Bros. Pictures,7500000,18869631,6.128,774,3.4015
986070,tt20916568,The Wrath of Becky,The Wrath of Becky,Hell hath no fury like a 16-year-old scorned.,"Two years after she escaped a violent attack on her family, 16-year-old Becky attempts to rebuild her life in the care of an older woman -- a kindred spirit named Elena. However, when a violent group known as the Noble Men break into their home, attack them and take their beloved dog, Becky must return to her old ways to protect herself and her loved ones.",2023-05-26,83,R,Action|Horror|Thriller,diner|machete|gore|sequel|revenge|murder|terrorism|dog|blood,English,US,Becky Collection,Suzanne Coote|Matt Angel,Lulu Wilson|Seann William Scott|Denise Burse|Jill Larson|Michael Sirow,Post Film|BoulderLight Pictures|Media Finance Capital|RainMaker Films|Yale Productions,199507,207118,6.309,453,3.2838
4464,tt0329575,Seabiscuit,Seabiscuit,The hopes of a nation rode on a long shot.,True story of the undersized Depression-era racehorse whose victories lifted not only the spirits of the team behind it but also those of their nation.,2003-07-22,141,PG-13,Drama|History,based on novel or book|horse race|american dream|horse|racehorse|great depression|based on true story|jockey|horse trainer|seabiscuit|1930s,English,US,,Gary Ross,Tobey Maguire|David McCullough|Jeff Bridges|Chris Cooper|Elizabeth Banks,Universal Pictures|DreamWorks Pictures|Spyglass Entertainment|Larger Than Life Productions|The Kennedy/Marshall Company,87000000,148300000,7.06,918,2.931
12277,tt0279493,Undercover Brother,Undercover Brother,He's All Action,"An Afro-American organization, the B.R.O.T.H.E.R.H.O.O.D., is in permanent fight against a white organization ""The Man"" defending the values of the black people in North America. When the Afro-American candidate Gen. Warren Boutwell behaves strangely in his presidential campaign, Undercover Brother is hired to work undercover for ""The Man"" and find what happened with the potential candidate.",2002-05-31,86,PG-13,Action|Comedy,double life|usa president|undercover|intelligence|satire|parody|partner|interracial relationship|spoof|blaxploitation cinema|racism|world domination|duringcreditsstinger,English,US,Undercover Brother Collection,Malcolm D. Lee,Eddie Griffin|Chris Kattan|Denise Richards|Aunjanue Ellis-Taylor|Chi McBride,Universal Pictures|Imagine Entertainment,25000000,41604473,5.874,416,2.7727
1051,tt0067116,The French Connection,The French Connection,Doyle is bad news—but a good cop.,Tough narcotics detective 'Popeye' Doyle is in hot pursuit of a suave French drug dealer who may be the key to a huge heroin-smuggling operation.,1971-10-09,104,R,Action|Crime|Thriller,"drug dealer|new york city|police brutality|drug smuggling|undercover agent|gangster|heroin|marseille, france|paranoia|night life|attempted murder|drug mule|train hijacking|police stakeout|police pursuit|popeye|academy award winner",English|French,US,French Connection Collection,William Friedkin,Gene Hackman|Roy Scheider|Fernando Rey|Tony Lo Bianco|Marcel Bozzuffi,D'Antoni Productions|Schine-Moore Productions|20th Century Fox,1800000,41200000,7.5,2093,3.095
4141,tt0465602,Shoot 'Em Up,Shoot 'Em Up,Just another family man making a living.,"A man named Mr. Smith delivers a woman's baby during a shootout, and is then called upon to protect the newborn from the army of gunmen.",2007-07-26,86,R,Action|Thriller|Comedy|Crime,dying and death|new love|hero|prostitute|baby|chase|ball|shootout|hobo,English|Italian,US,,Michael Davis,Clive Owen|Paul Giamatti|Monica Bellucci|Stephen McHattie|Greg Bryk,New Line Cinema|Don Murphy Productions,39000000,26800000,6.476,2030,3.2917
10836,tt0264508,Dagon,Dagon,A cursed people... an ancient cult... a nightmare come true.,"A boating accident off the coast of Spain sends Paul and his girlfriend Barbara to the decrepit fishing village of Imboca. As night falls, people start to disappear and things not quite human start to appear. Paul is pursued by the entire town. Running for his life, he uncovers Imboca's secret..they worship Dagon, a monstrous god of the sea...and Dagon's unholy offspring are on the loose...",2001-10-12,95,18,Fantasy|Horror|Thriller,suicide|dreams|spain|sibling relationship|nightmare|sacrifice|octopus|mutant|gore|god|cthulhu|giant octopus|blood|lovecraftian|flaying,English|Galician|Spanish,ES,,Stuart Gordon,Ezra Godden|Francisco Rabal|Raquel Meroño|Macarena Gómez|Brendan Price,Castelao Productions|Estudios Picasso|TV3|TVG|Vía Digital|Xunta de Galicia|ICEC,4800000,0,6.146,462,3.2052
333352,tt2057392,Eye in the Sky,Eye in the Sky,Welcome to the new front line,"A UK-based military officer in command of a top secret drone operation to capture terrorists in Kenya discovers the targets are planning a suicide bombing and the mission escalates from “capture” to “kill.” As American pilot Steve Watts is about to engage, a nine-year old girl enters the kill zone, triggering an international dispute reaching the highest levels of US and British government over the moral, political, and personal implications of modern warfare.",2015-09-07,102,R,Drama|Thriller|War,drone|terrorism|duringcreditsstinger|us military|air force base|combat drone,Somali|English,GB,,Gavin Hood,Helen Mirren|Aaron Paul|Alan Rickman|Barkhad Abdi|Jeremy Northam,Raindog Films|Entertainment One Features,13000000,18704595,6.999,1707,3.025
37931,tt1470023,MacGruber,MacGruber,He's the ultimate tool.,"Ex-special operative MacGruber is called back into action to take down his archenemy, Dieter Von Cunth, who's in possession of a nuclear warhead and bent on destroying Washington, DC.",2010-05-21,90,R,Action|Comedy,parody|aftercreditsstinger|duringcreditsstinger,English|Russian|Spanish,US,,Jorma Taccone,Will Forte|Kristen Wiig|Ryan Phillippe|Powers Boothe|Maya Rudolph,Universal Studios|Relativity Media|Rogue Pictures|Michaels-Goldwyn|Universal Pictures,10000000,9322895,5.414,597,2.9988
11524,tt0083190,Thief,Thief,"Tonight, his take home pay is $410,000... tax free.","Frank is an expert professional safecracker, specialized in high-profile diamond heists. He plans to use his ill-gotten income to retire from crime and build a nice life for himself complete with a home, wife and kids. To accelerate the process, he signs on with a top gangster for a big score.",1981-03-27,123,R,Crime|Thriller|Drama,"chicago, illinois|based on novel or book|shadowing|loss of loved one|burglar|gangster|car dealer|rain|idealist|safe|error|thief|dirty cop|convict|diamond heist|ex-con|safecracker|police surveillance|neo-noir|provocative|violence|suspenseful|critical|ambiguous|assertive|awestruck|commanding|harsh",English,US,,Michael Mann,James Caan|Tuesday Weld|Robert Prosky|Willie Nelson|Jim Belushi,Mann/Caan Productions|United Artists,5500000,11494812,7.21,813,3.0917
823482,tt21942866,Dream Scenario,Dream Scenario,Meet the man of your dreams.,"Hapless family man Paul Matthews finds his life turned upside down when millions of strangers suddenly start seeing him in their dreams. But when his nighttime appearances take a nightmarish turn, Paul is forced to navigate his newfound stardom.",2023-11-10,102,R,Comedy|Fantasy,dreams|nightmare|professor|sleep|subconsciousness|dark comedy|satire|family relationships|shared dream|psychological|psychological horror|cancel culture|bewildered|dream,English|French,US,,Kristoffer Borgli,Nicolas Cage|Julianne Nicholson|Michael Cera|Tim Meadows|Dylan Gelula,A24|Square Peg|Saturn Films,10000000,14114415,6.648,1262,3.1361
758009,tt9686790,Shotgun Wedding,Shotgun Wedding,Save the day.,"Darcy and Tom gather their families for the ultimate destination wedding but when the entire party is taken hostage, “’Til Death Do Us Part” takes on a whole new meaning. Now, Darcy and Tom must save their loved ones—if they don’t kill each other first.",2022-12-28,101,R,Action|Comedy|Romance,pirate gang|ex fiancé|philippines|wedding|hostage situation|baseball player|perfectionist|fiancé fiancée relationship|divorced parents|family problems|past relationship|self-sabotage|imminent wedding|arguing couple|beach wedding|peace corps|destination wedding|island resort|sea pirates,English,US,,Jason Moore,Jennifer Lopez|Josh Duhamel|Lenny Kravitz|Jennifer Coolidge|Sônia Braga,Mandeville Films|Nuyorican Productions,0,4495365,6.245,1284,3.0528
2539,tt0371246,Spanglish,Spanglish,Every family has a hero.,"Mexican immigrant and single mother Flor Moreno finds housekeeping work with Deborah and John Clasky, a well-off couple with two children of their own. When Flor admits she can't handle the schedule because of her daughter, Cristina, Deborah decides they should move into the Clasky home. Cultures clash and tensions run high as Flor and the Claskys struggle to share space while raising their children on their own, and very different, terms.",2004-12-17,130,PG-13,Drama|Comedy,immigrant|class society|mother|husband wife relationship|single parent|language course|upper class|parent child relationship|class|illegal immigration|language barrier|family's daily life|platonic love|deceived husband|usa–mexico border|biography|relationship problems|milieu|hysteria|single|american|father figure,Spanish|English,US,,James L. Brooks,Adam Sandler|Téa Leoni|Paz Vega|Cloris Leachman|Shelbie Bruce,Gracie Films|Columbia Pictures,80000000,55470154,6.035,1368,2.9197
2610,tt0338427,Shopgirl,Shopgirl,,"Mirabelle is a disenchanted salesgirl and aspiring artist who sells gloves and accessories at a department store. She has two men in her life: wealthy divorcée Ray Porter and struggling musician Jeremy. Mirabelle falls in love with the glamorous Ray, and her life takes a magical turn, but eventually she realizes that she must empower herself and make a choice between them.",2005-10-21,104,R,Comedy|Drama|Romance,salesclerk,English,US,,Anand Tucker,Steve Martin|Claire Danes|Jason Schwartzman|Bridgette Wilson-Sampras|Sam Bottoms,Touchstone Pictures|Epsilon Motion Pictures|Hyde Park Entertainment|Shopgirl,10284523,11588205,5.8,275,3.3036
2114,tt0173840,Final Fantasy: The Spirits Within,Final Fantasy: The Spirits Within,Unleash a new reality,"Led by a strange dream, scientist Aki Ross struggles to collect the eight spirits in the hope of creating a force powerful enough to protect the planet. With the aid of the Deep Eyes Squadron and her mentor, Dr. Sid, Aki must save the Earth from its darkest hate and unleash the spirits within.",2001-07-02,106,PG-13,Adventure|Action|Fantasy|Science Fiction|Animation,future|dystopia|post-apocalyptic future|space travel|battle assignment|alien|downfall|soldier|scientist|fictional war|based on video game|adult animation|military|soul transference|motion capture|female scientist|alien creature|2060s,English,US,,Hironobu Sakaguchi,Ming-Na Wen|Donald Sutherland|Alec Baldwin|Ving Rhames|Steve Buscemi,Chris Lee Productions|Square Pictures|Square USA|Columbia Pictures,137000000,85131830,6.195,1561,3.3787
556694,tt9198364,Three Thousand Years of Longing,Three Thousand Years of Longing,What would you wish for?,"A solitary scholar discovers an ancient bottle while on a trip to Istanbul and unleashes a djinn who offers her three wishes. Filled with reluctance, she is unable to come up with one, so the djinn tries to inspire her with his stories.",2022-08-24,108,R,Drama|Fantasy|Romance,"mythology|longing|djinn|desire|storytelling|wish fulfillment|genie|public speaking|istanbul, turkey|scholar|lonely woman|wishes|doctorate|romantic",English|Greek|Turkish|German,AU|US,,George Miller,Tilda Swinton|Idris Elba|Erdil Yaşaroğlu|Sabrina Elba|Sarah Houbolt,FilmNation Entertainment|Elevate Production Finance|Sunac Pictures|Kennedy Miller Mitchell,60000000,20300000,6.879,1622,3.5265
44945,tt1529572,Trust,Trust,"What took her family years to build, a stranger stole in an instant.","A suburban family is torn apart when fourteen-year-old Annie meets her first boyfriend online. After months of communicating via online chat and phone, Annie discovers her friend is not who he originally claimed to be. Shocked into disbelief, her parents are shattered by their daughter's actions and struggle to support her as she comes to terms with what has happened to her once innocent life.",2010-09-10,104,R,Crime|Drama|Thriller,pedophilia|high school|child abuse|rape|sexual abuse|obsession|lie|paedophilia|teenage girl|school|internet|best friend|counselor|internet chat|duringcreditsstinger|online dating|online chat|catfishing|online hookup|online predator|child sexual abuse|swear,English,US,,David Schwimmer,Clive Owen|Catherine Keener|Liana Liberato|Jason Clarke|Viola Davis,Dark Harbor Stories|Nu Image|Millennium Media,9500000,120000,6.542,1031,2.9463
537921,tt8785038,Fixed,Fixed,Obedience training is out the window.,"After learning he's getting neutered, a dog has 24 hours to squeeze in one last balls-to-the-wall adventure with the boys.",2025-08-13,87,R,Animation|Comedy,pet|dog|animals|adult animation,English,US,,Genndy Tartakovsky,Adam Devine|Idris Elba|Kathryn Hahn|Fred Armisen|Bobby Moynihan,Sony Pictures Animation,3000000,0,6.211,140,3.1777
17332,tt0821642,The Soloist,The Soloist,Life has a mind of its own,"A Los Angeles journalist befriends a homeless Juilliard-trained musician, while looking for a new article for the paper.",2009-04-24,117,PG-13,Drama|Music,"newspaper|schizophrenia|musician|violin|cello|based on true story|los angeles, california|unlikely friendship|homeless man|theater audience",English,US,,Joe Wright,Robert Downey Jr.|Jamie Foxx|Catherine Keener|Tom Hollander|Nelsan Ellis,DreamWorks Pictures|Universal Pictures|StudioCanal|Participant|Krasnoff / Foster Entertainment|Working Title Films,60000000,38332994,6.674,812,2.7907
800815,tt14138650,The Pale Blue Eye,The Pale Blue Eye,Every heart tells a tale.,"West Point, New York, 1830. When a cadet at the burgeoning military academy is found hanged with his heart cut out, the top brass summons former New York City constable Augustus Landor to investigate. While attempting to solve this grisly mystery, the reluctant detective engages the help of one of the cadets: a strange but brilliant young fellow by the name of Edgar Allan Poe.",2022-12-22,128,R,Thriller|Crime|Horror|Mystery,based on novel or book|winter|detective|investigation|historical figure|murder|gothic horror|occult|west point|book|1830s,English|French|Latin,US,,Scott Cooper,Christian Bale|Harry Melling|Lucy Boynton|Toby Jones|Simon McBurney,Cross Creek Pictures|Le Grisbi Productions,72000000,0,6.811,2125,3.2838
26268,tt0060490,Harper,Harper,Harper takes a case - and the payoff is murder.,"Harper is a cynical private eye in the best tradition of Bogart. He even has Bogie's Baby hiring him to find her missing husband, getting involved along the way with an assortment of unsavory characters and an illegal-alien smuggling ring.",1966-02-22,121,NR,Mystery|Crime|Thriller,"adultery|husband wife relationship|based on novel or book|kidnapping|nightclub|investigation|swimming pool|murder|los angeles, california|divorce|private detective|missing person|nightclub singer|private eye|lew harper|wealthy family",English,US,Lew Harper Collection,Jack Smight,Paul Newman|Lauren Bacall|Julie Harris|Arthur Hill|Janet Leigh,Gershwin-Kastner|Warner Bros. Pictures,3500000,12000000,6.6,184,3.0804
11000,tt0115685,The Birdcage,The Birdcage,Come as you are.,A gay cabaret owner and his drag queen partner agree to put up a false heterosexual front so that their son can introduce them to his fiancée's conservative parents.,1996-03-03,119,R,Comedy,coming out|florida|homophobia|drag queen|nightclub|senator|politician|based on play or musical|remake|conservative|cross dressing|gay parent|lgbt|political conflict|south beach|playing straight|drag club,English|French,US,,Mike Nichols,Robin Williams|Gene Hackman|Nathan Lane|Dianne Wiest|Dan Futterman,United Artists,31000000,185300000,7.1,1325,3.6907
144336,tt1742334,Sabotage,Sabotage,Leave no loose ends,"John 'Breacher' Wharton leads an elite DEA task force that takes on the world's deadliest drug cartels. When the team successfully executes a high-stakes raid on a cartel safe house, they think their work is done – until, one-by-one, the team members mysteriously start to be eliminated. As the body count rises, everyone is a suspect.",2014-03-28,110,R,Action|Drama|Thriller|Crime,mexico|hostage|drug addiction|atlanta|strip club|drug cartel|crime scene|police corruption|brutality|drugs|bribe|dea,English,US,,David Ayer,Arnold Schwarzenegger|Sam Worthington|Olivia Williams|Terrence Howard|Joe Manganiello,Open Road Films|QED International|ASR Productions|Crave Films|Roth Films|Universal Pictures,35000000,22126842,5.608,1506,3.033
2001,tt0498399,We Own the Night,We Own the Night,Two brothers on opposite sides of the law. Beyond their differences lies loyalty.,A New York nightclub manager tries to save his brother and father from Russian mafia hitmen.,2007-10-12,118,R,Drama|Crime|Thriller,"new york city|parent child relationship|bratva (russian mafia)|gangster|cocaine|nightclub|investigation|police chief|arrest|murder|shootout|hospital|raid|drugs|pursuit|brooklyn, new york city|1980s|protective custody",English|Russian,US,,James Gray,Joaquin Phoenix|Mark Wahlberg|Eva Mendes|Robert Duvall|Alex Veadov,2929 Productions|Nick Wechsler Productions|Columbia Pictures,21000000,55033767,6.689,1482,3.1448
133931,tt1488181,Zambezia,Zambezia,Airborne to be wild.,"Set in a bustling bird city on the edge of the majestic Victoria Falls, ""Zambezia"" is the story of Kai - a naïve, but high-spirited young falcon who travels to the bird city of ""Zambezia"" where he discovers the truth about his origins and, in defending the city, learns how to be part of a community.",2012-06-05,83,G,Comedy|Animation|Adventure|Family,falcon,English,US,,Wayne Thornley,Samuel L. Jackson|Abigail Breslin|Leonard Nimoy|Jeremy Suarez|Jeff Goldblum,"The Department of Trade, Industry and Competition of South Africa|The National Film and Video Foundation of South Africa|Wonderful Works|120dB Films|Triggerfish",20000000,0,6.2,322,3.1252
41216,tt1219342,Legend of the Guardians: The Owls of Ga'Hoole,Legend of the Guardians: The Owls of Ga'Hoole,On his way to finding a legend...he will become one.,"When a young owl is abducted by an evil Owl army, he must escape with new-found friends and seek the legendary Guardians to stop the menace.",2010-07-10,97,PG,Animation|Adventure|Family|Fantasy,friendship|villain|heroism|brother against brother|clash of clans|owl,English,AU|US,,Zack Snyder,Jim Sturgess|Ryan Kwanten|Hugo Weaving|Helen Mirren|Geoffrey Rush,Warner Bros. Pictures|Village Roadshow Pictures|Animal Logic|GOG Productions,80000000,140073390,6.821,2444,2.9867
