tmdb_id,imdb_id,title,original_title,tagline,overview,release_date,runtime_mins,certification,genres,keywords,spoken_languages,origin_country,collection,director,top_cast,production_companies,budget,revenue,vote_average,vote_count,popularity
2642,tt0313737,Two Weeks Notice,Two Weeks Notice,Over. Done. Finished. A comedy about love at last glance.,"Dedicated environmental lawyer Lucy Kelson goes to work for billionaire George Wade as part of a deal to preserve a community center. Indecisive and weak-willed George grows dependent on Lucy's guidance on everything from legal matters to clothing. Exasperated, Lucy gives notice and picks Harvard graduate June Carter as her replacement. As Lucy's time at the firm nears an end, she grows jealous of June and has second thoughts about leaving George.",2002-12-19,101,PG-13,Romance|Comedy,new york city|deal|sarcasm|protest|romcom|lawyer|billionaire|employer employee relationship|pro bono|aftercreditsstinger|environmental law|legal aid|charity benefit|community center|ideals|indispensable|playboy billionaire,English,US,,Marc Lawrence,Sandra Bullock|Hugh Grant|Dana Ivey|Robert Klein|Alicia Witt,Fortis Films|Castle Rock Entertainment|Village Roadshow Pictures|NPV Entertainment,60000000,199043242,6.355,2187,3.5845
7450,tt0120913,Titan A.E.,Titan A.E.,Get ready for the human race.,"A young man finds out that he holds the key to restoring hope and ensuring survival for the human race, while an alien species called the Drej are bent on mankind's destruction.",2000-06-16,95,PG,Animation|Science Fiction|Adventure|Family|Action,galaxy|mission|monster|dystopia|alien|space,English|Mandarin,US,,Don Bluth|Gary Goldman,Matt Damon|Bill Pullman|Drew Barrymore|John Leguizamo|Nathan Lane,David Kirschner Productions|Gary Goldman Productions|20th Century Fox|20th Century Fox Animation,75000000,36754634,6.607,1166,3.8989
5902,tt0075784,A Bridge Too Far,A Bridge Too Far,Out of the sky comes the screen's most incredible spectacle of men and war!,The story of Operation Market Garden—a failed attempt by the allies in the latter stages of WWII to end the war quickly by securing three bridges in Holland allowing access over the Rhine into Germany. A combination of poor allied intelligence and the presence of two crack German panzer divisions meant that the final part of this operation (the bridge in Arnhem over the Rhine) was doomed to failure.,1977-06-15,175,PG,Drama|History|War,mission|army|allies|world war ii|netherlands|bridge|tank|based on true story|operation market garden|soldier|arnhem|military operation|1940s|historical battle|dramatic,English|Dutch|Polish|German|Latin,US|GB,,Richard Attenborough,Dirk Bogarde|James Caan|Michael Caine|Sean Connery|Edward Fox,United Artists|Joseph E. Levine Productions,22000000,50750000,7.2,909,3.2562
1408,tt0112760,Cutthroat Island,Cutthroat Island,Be bold. Be brave. Be prepared.,"Morgan Adams and her slave, William Shaw, are on a quest to recover the three portions of a treasure map. Unfortunately, the final portion is held by her murderous uncle, Dawg. Her crew is skeptical of her leadership abilities, so she must complete her quest before they mutiny against her. This is made yet more difficult by the efforts of the British crown to end her pirate raids.",1995-12-22,124,PG-13,Action|Adventure,ship|treasure|exotic island|island|map|scalp|treasure map|sword fight|betrayal|pirate|heroine|swashbuckler|adventurer|pirate ship|17th century,English|Spanish|French|Latin,US,,Renny Harlin,Geena Davis|Matthew Modine|Frank Langella|Maury Chaykin|Patrick Malahide,Carolco Pictures|Forge|Laurence Mark Productions|Beckner/Gorman Productions|Le Studio Canal+|Tele-Communications|RCS Video|Cutthroat Productions L.P.,102000000,16000000,5.787,608,3.0911
419704,tt2935510,Ad Astra,Ad Astra,The answers we seek are just outside our reach.,"The near future, a time when both hope and hardships drive humanity to look to the stars and beyond. While a mysterious phenomenon menaces to destroy life on planet Earth, astronaut Roy McBride undertakes a mission across the immensity of space and its many perils to uncover the truth about a lost expedition that decades before boldly faced emptiness and silence in search of the unknown.",2019-09-17,123,PG-13,Science Fiction|Drama,moon|planet mars|loss of loved one|astronaut|moon colony|solar system|solitude|spacewalk|father son relationship|near future|planet neptune|space walk,English|Norwegian,US,,James Gray,Brad Pitt|Tommy Lee Jones|Liv Tyler|Ruth Negga|Donald Sutherland,New Regency Productions|MadRiver Pictures|Plan B Entertainment|RT Features|Bona Film Group|TSG Entertainment|Keep Your Head Productions|20th Century Fox|Regency Enterprises,87500000,127461872,6.126,7121,3.3548
14882,tt0415856,Hounddog,Hounddog,Every heart has an awakening. Every soul needs a song.,"A drama set in the American South, where a precocious, troubled girl finds a safe haven in the music and movement of Elvis Presley.",2008-09-19,102,R,Drama|Music,woman director,English,US,,Deborah Kampmeier,Dakota Fanning|Oliver Clayton-Luce|Isabelle Fuhrman|Cody Hanford|Piper Laurie,"Motion Picture Group, The",0,0,6.422,135,4.3716
1255718,tt27550504,Plainclothes,Plainclothes,Everyone has a secret.,"In 1990s New York, an undercover police officer receives an assignment to lure and arrest gay men. However, he's surprised to discover a scintillating connection with one of his targets. As their secret connection deepens and internal pressure to deliver arrests intensifies, he finds himself torn between duty and desire.",2025-01-26,97,16,Drama|Romance|Crime,"entrapment|ex-girlfriend|based on true story|death of father|grief|undercover cop|sexual confusion|mall|lgbt|sting operation|shame|hookup|1990s|syracuse, new york|closeted homosexual|mother son relationship|gay theme|suspenseful|intense",English,US,,Carmen Emmi,Tom Blyth|Russell Tovey|Amy Forsyth|Maria Dizzia|Christian Cooke,Lorton Entertainment|Page 1,0,0,7.25,62,3.1129
9400,tt0117603,Set It Off,Set It Off,It's about crime. It's about payback. It's about survival.,"Four inner-city Black women, determined to end their constant struggle, decide to live by one rule — get what you want or die trying. So the four women take back their lives and take out some banks in the process.",1996-11-06,123,R,Crime|Drama|Thriller|Action|Romance,"single parent|bank robber|last chance|heist|los angeles, california|biting|angry|somber|complex|cautionary|incredulous|authoritarian|hopeful|pessimistic|scathing",English,US,,F. Gary Gray,Jada Pinkett Smith|Queen Latifah|Vivica A. Fox|Kimberly Elise|Blair Underwood,New Line Cinema|Peak Productions,9000000,41590886,7.207,393,3.1083
457840,tt6868216,Psych: The Movie,Psych: The Movie,,"The ambitious friends come together during the holidays after a mystery assailant targets one of their own. A comedic thrill-ride follows, as the wild and unpredictable Psych team pursues the bad guys, justice … and, of course, food!",2017-12-07,88,PG,Comedy|Crime|Mystery|TV Movie,based on tv series,English,US,Psych Collection,Steve Franks,James Roday Rodriguez|Dulé Hill|Maggie Lawson|Corbin Bernsen|Kirsten Nelson,UCP|Thruline Entertainment|Pacific Mountain Productions,0,0,7.3,247,2.8089
1032372,tt17067574,Cold Meat,Cold Meat,Outside is dangerous. Inside is deadly.,"David Petersen is passing through the Colorado Rockies. After saving a young diner waitress from her violent ex-husband during a break from driving, he hits the road again alone through a dangerous snow blizzard. One false move behind the wheel has him waking up inside a ravine, in the eye of the storm. But the cold is the least of his worries when a beast starts prowling outside. How will he survive?",2024-02-23,89,16,Thriller|Horror,kidnapping|snowstorm|held captive|held hostage|kidnapped,English,GB|CA,,Sébastien Drouin,Allen Leech|Nina Bergman|Yan Tual|James Barton-Steel|Riley Banzer,Featuristic Films|Trilight Entertainment,0,0,6.535,141,2.7798
11336,tt0085407,The Dead Zone,The Dead Zone,"In his mind, he has the power to see the future. In his hands, he has the power to change it.","Johnny Smith is a schoolteacher with his whole life ahead of him but, after leaving his fiancee's home one night, is involved in a car crash which leaves him in a coma for 5 years. When he wakes, he discovers he has an ability to see into the past, present and future life of anyone with whom he comes into physical contact.",1983-10-21,103,R,Thriller|Horror|Science Fiction,sheriff|coma|based on novel or book|sacrifice|flashback|premonition|vision|doctor|car accident|series of murders|psychic|dark hero|gothic|madness,English|Russian,US,,David Cronenberg,Christopher Walken|Brooke Adams|Tom Skerritt|Herbert Lom|Anthony Zerbe,The De Laurentiis Company|Lorimar Motion Pictures,10000000,20766616,7.012,1792,2.9666
615469,tt9783600,Spiderhead,Spiderhead,How far would you go to fix human nature?,A prisoner in a state-of-the-art penitentiary begins to question the purpose of the emotion-controlling drugs he's testing for a pharmaceutical genius.,2022-06-17,107,R,Science Fiction|Thriller,dystopia|psychological stress|prison escape|psychological thriller|inmate|based on short story|psychotronic|drug testing,English,US,,Joseph Kosinski,Chris Hemsworth|Miles Teller|Jurnee Smollett|Mark Paguio|Tess Haubrich,Grand Electric|The New Yorker Studios,0,0,5.794,1716,3.0707
169881,tt2101473,The Physician,The Physician,A journey out of darkness into light,"England, 1021: Born in a miserable mining town, Robert Cole swears to become a physician and vanquish disease and death. His harsh path of many years, a quest for knowledge besieged by countless challenges and sacrifices, leads him to the remote Isfahan, in Persia, where he meets Ibn Sina, the greatest healer of his time.",2013-12-25,155,R,Adventure|Drama|History,based on novel or book|persia|jew persecution|historical figure|religious fundamentalism|teacher student relationship|middle ages (476-1453)|medieval|black death|medical student|11th century|medieval england|medieval physician|seljuk turks,English,DE,The Physician Collection,Philipp Stölzl,Tom Payne|Ben Kingsley|Stellan Skarsgård|Olivier Martinez|Emma Rigby,Pixomondo|UFA Cinema|CinePostproduction|Cine Mobil|ARD|ARD Degeto,36000000,57284237,7.34,1159,3.0578
49948,tt0120910,Fantasia 2000,Fantasia 2000,,"Blending lively music and brilliant animation, this sequel to the original 'Fantasia' restores 'The Sorcerer's Apprentice' and adds seven new shorts.",2000-01-01,74,G,Animation|Family|Music,magic|classical music|orchestra|musical|live action and animation|magician|mickey mouse|1999,English,US,Fantasia Collection,James Algar|Gaëtan Brizzi|Paul Brizzi|Hendel Butoy|Francis Glebas|Eric Goldberg|Don Hahn|Pixote Hunt,Steve Martin|Itzhak Perlman|Quincy Jones|Bette Midler|James Earl Jones,Walt Disney Pictures|Walt Disney Feature Animation,80000000,60655420,6.97,1358,3.2895
13291,tt0988047,Traitor,Traitor,The truth is complicated.,"When straight arrow FBI agent Roy Clayton heads up the investigation into a dangerous international conspiracy, all clues seem to lead back to former U.S. Special Operations officer Samir Horn.",2008-08-23,114,PG-13,Drama|Action|Thriller|Crime,prison|escape|bomb|alcohol|faith|kidnapping|traitor|delinquent|car bomb|devout,Arabic|English|French,US,,Jeffrey Nachmanoff,Don Cheadle|Guy Pearce|Neal McDonough|Saïd Taghmaoui|Jeff Daniels,Mandeville Films|Hyde Park Entertainment|Crescendo Productions|Overture Films|Paramount Vantage,22000000,23530831,6.655,700,2.9769
328111,tt2709768,The Secret Life of Pets,The Secret Life of Pets,Ever wonder what your pets do when you're not home?,"The quiet life of a terrier named Max is upended when his owner takes in Duke, a stray whom Max instantly dislikes.",2016-06-18,86,PG,Family|Comedy|Adventure|Animation,"bunny|pet|anthropomorphism|dog|animals|apartment building|sewer|terrier|manhattan, new york city|rodent|pets|mongrel",English,US,The Secret Life of Pets Collection,Chris Renaud,Louis C.K.|Eric Stonestreet|Kevin Hart|Jenny Slate|Ellie Kemper,Illumination|Universal Pictures,75000000,875457937,6.3,8440,2.5896
3110,tt0046303,Shane,Shane,The greatest story of the West ever filmed!,"A weary gunfighter attempts to settle down with a homestead family, but a smouldering settler and rancher conflict forces him to act.",1953-04-23,118,NR,Drama|Western,friendship|showdown|based on novel or book|gun|harassment|settler|fistfight|little boy|gunfight|homesteader|intimidation|homestead|cattle ranch|gunfighter|cattleman|starting over|newcomer|adult child friendship|land rights,English,US,,George Stevens,Alan Ladd|Jean Arthur|Van Heflin|Brandon De Wilde|Jack Palance,Paramount Pictures,3100000,20000000,7.341,671,3.3653
990,tt0054997,The Hustler,The Hustler,They called him Fast Eddie. He was a winner. He was a loser. He was a hustler.,Fast Eddie Felson is a small-time pool hustler with a lot of talent but a self-destructive attitude. His bravado causes him to challenge the legendary Minnesota Fats to a high-stakes match.,1961-09-25,134,NR,Drama|Romance,new york city|suicide|based on novel or book|sports|gambling|alcohol|manager|pool billiards|hustler|money|black and white|game|drunk|pool,English,US,The Hustler Collection,Robert Rossen,Paul Newman|Jackie Gleason|Piper Laurie|George C. Scott|Myron McCormick,Rossen Films|20th Century Fox,2000000,7600000,7.683,1060,2.7322
25562,tt0102951,Soapdish,Soapdish,All that glitter... All that glamour... All that dirt.,"Celeste Talbert is the star of the long-running soap opera ""The Sun Also Sets."" With the show's ratings down, Celeste's ruthlessly ambitious co-star, Montana Moorehead, and the show's arrogant producer, David Seton Barnes, plot to aggravate her into leaving the show by bringing back her old flame, Jeffrey Anderson, and hiring her beautiful young niece, Lori Craven.",1991-05-31,97,PG-13,Comedy,tv show in film|television broadcast,English,US,,Michael Hoffman,Sally Field|Kevin Kline|Robert Downey Jr.|Cathy Moriarty|Teri Hatcher,Paramount Pictures,25000000,36489888,6.3,266,2.8083
218784,tt1817771,Freaks of Nature,Freaks of Nature,Get out undead or alive.,"In the town of Dillford, humans, vampires and zombies were all living in peace - until the alien apocalypse arrived. Now three teenagers-one human, one vampire, and one zombie-have to team up to figure out how to get rid of the visitors.",2015-10-30,92,R,Science Fiction|Comedy|Horror,small town|vampire|alien|zombie,English,US,,Robbie Pickering,Nicholas Braun|Mackenzie Davis|Josh Fadem|Vanessa Hudgens|Ed Westwick,Columbia Pictures|Matt Tolmach Productions|LStar Capital,0,70958,6.109,601,2.6821
502345,tt4556264,Scarygirl,Scarygirl,She was made to be a hero.,"As her world is shrouded in darkness, a young girl must overcome her fears and travel to a mysterious city of light, save her father from a dangerous scientist and prevent the destruction of her planet.",2023-10-05,90,PG,Animation|Adventure|Family|Fantasy,octopus|animals|healing power|tentacles|father daughter relationship|loss of child|sacred tree|talking animal,English,AU,,Ricard Cussó,Jillian Nguyen|Remy Hii|Sam Neill|Rob Collins|Tim Minchin,Passion Pictures Australia|Highly Spirited|Like A Photon Creative|Cosmic Dino Studio|Alceon Entertainment Partners|Madman Entertainment,0,1194805,6.9,67,4.0296
48171,tt1161864,The Rite,The Rite,You can only defeat it when you believe.,"Seminary student Michael Kovak reluctantly attends exorcism school at the Vatican. While he’s in Rome, Michael meets an unorthodox priest who introduces him to the darker side of his faith, uncovering the devil’s reach even to one of the holiest places on Earth.",2011-01-28,114,PG-13,Drama|Thriller|Horror,vatican (holy see)|exorcism|violinist|god|priest|hospital|church|devil|miscarriage|roman catholic church|exorcist|disbelief|seminary|limp|toad|clergy|formalin|scepticism|horrified,English|Italian|Hungarian|Russian|Latin|Welsh,US,,Mikael Håfström,Anthony Hopkins|Colin O'Donoghue|Alice Braga|Rutger Hauer|Ciarán Hinds,New Line Cinema|Contrafilm|Mid Atlantic Films,37000000,96047633,6.128,2202,2.7615
864168,tt15268244,Joy Ride,Joy Ride,Four friends. One trip. No luck.,"When Audrey's business trip to Asia goes sideways, she enlists the aid of Lolo, her irreverent, childhood best friend who also happens to be a hot mess; Kat, her college friend turned Chinese soap star; and Deadeye, Lolo's eccentric cousin. Their no-holds-barred, epic experience becomes a journey of bonding, friendship, belonging, and wild debauchery that reveals the universal truth of what it means to know and love who you are.",2023-06-22,94,R,Comedy,female friendship|adopted child|woman director|asian american,English|Mandarin|Korean|Spanish,US,,Adele Lim,Ashley Park|Sherry Cola|Stephanie Hsu|Sabrina Wu|Ronny Chieng,Lionsgate|Point Grey Pictures|Red Mysterious Hippo,20000000,15800000,6.502,469,3.0218
109443,tt1229340,Anchorman 2: The Legend Continues,Anchorman 2: The Legend Continues,Bigger. Better. Burgundy-er.,"With the 70s behind him, San Diego's top rated newsman, Ron Burgundy, returns to take New York's first 24-hour news channel by storm.",2013-12-18,119,PG-13,Comedy,journalism|language|mustache|gang warfare|aftercreditsstinger|news spoof|news|tv news anchor|cable news,English,US,Anchorman Collection,Adam McKay,Will Ferrell|Steve Carell|Paul Rudd|David Koechner|Christina Applegate,Gary Sanchez Productions|Paramount Pictures|Apatow Productions,50000000,173700000,6.14,2768,3.3695
12219,tt0118528,12 Angry Men,12 Angry Men,,"During the trial of a man accused of his father's murder, a lone juror takes a stand against the guilty verdict handed down by the others as a result of their preconceptions and prejudices.",1997-08-17,117,PG-13,Drama|TV Movie,death penalty|right and justice|court|judge|jurors|revelation|trial|jury|remake|lawyer|argument|xenophobia|judicial system,English,US,,William Friedkin,Courtney B. Vance|Ossie Davis|George C. Scott|Armin Mueller-Stahl|Dorian Harewood,MGM Television,1750000,2000000,7.67,429,2.9681
795514,tt11847410,The Fallout,The Fallout,Nothing will ever be the same.,"In the wake of a school tragedy, Vada, Mia and Quinton form a unique and dynamic bond as they navigate the never linear, often confusing journey to heal in a world that feels forever changed.",2021-03-17,96,R,Drama,high school|trauma|coming of age|female protagonist|teenage daughter|school shooting|woman director|generation z|sister sister relationship|teenage|teen,English,US,,Megan Park,Jenna Ortega|Maddie Ziegler|Niles Fitch|Will Ropp|Lumi Pollack,Clear Horizon Entertainment|SSS Entertainment,0,0,7.514,1282,3.3017
1373723,tt32044730,The Codes of War,The Codes of War,,"War stories about family, ethics and honor include the true story of two U.S. Marines who in a span of six seconds, must stand their ground to stop a suicide truck bomb, a Navy Corpsman who attempts to hold on to his humanity, and a WW2 soldier who gets separated from his squad and is forced to re-evaluate his code.",2025-03-20,92,15,Action|War,,English,US,,Paul Anderson|Joshua DeFour|Marielle Woods,Noah Gray-Cabey|Michael Grant,,0,0,6.2,62,3.6484
245627,tt1480285,Abattoir,Abattoir,He's been expecting you,A reporter unearths an urban legend about a home being constructed from rooms where horrific tragedies have occurred.,2016-11-24,98,R,Horror|Thriller,home|haunted house|based on comic|serial killer|crime scene|hooded figure|evangelist,Thai|English,US,,Darren Lynn Bousman,Jessica Lowndes|Joe Anderson|Lin Shaye|Dayton Callie|Michael Paré,Radical Pictures|Dark Web Productions|Les Enfants Terribles|Luminary Entertainment|Pacific Bridge Pictures,0,0,4.483,147,3.2217
41233,tt1193631,Step Up 3D,Step Up 3D,Two worlds. One dream.,"A tight-knit group of New York City street dancers, including Luke and Natalie, team up with NYU freshman Moose, and find themselves pitted against the world's best hip-hop dancers in a high-stakes showdown that will change their lives forever.",2010-08-04,107,PG-13,Drama|Romance,dance|musical|duringcreditsstinger,English,US,Step Up Collection,Jon M. Chu,Sharni Vinson|Rick Malambri|Adam Sevani|Alyson Stoner|Joe Slaughter,Touchstone Pictures|Summit Entertainment,30000000,159291809,6.8,1972,3.2065
9994,tt0091149,The Great Mouse Detective,The Great Mouse Detective,London's crime-fighting ace on his most baffling case!,"When the diabolical Professor Ratigan kidnaps London's master toymaker, the brilliant master of disguise Basil of Baker Street and his trusted sidekick Dawson try to elude the ultimate trap and foil the perfect crime.",1986-07-02,74,G,Animation|Family|Adventure|Mystery,"london, england|detective|queen|mouse|villain|victorian england|thug|cartoon mouse|19th century|whimsical",English,US,,Ron Clements|Burny Mattinson|David Michener|John Musker,Barrie Ingham|Vincent Price|Val Bettin|Susanne Pollatschek|Candy Candido,Silver Screen Partners II|Walt Disney Pictures,14000000,38600000,7.049,1781,3.0468
486131,tt4463894,Shaft,Shaft,More Shaft than you can handle.,"JJ, aka John Shaft Jr., may be a cyber security expert with a degree from MIT, but to uncover the truth behind his best friend’s untimely death, he needs an education only his dad can provide. Absent throughout JJ’s youth, the legendary locked-and-loaded John Shaft agrees to help his progeny navigate Harlem’s heroin-infested underbelly.",2019-06-14,111,R,Action|Crime|Comedy|Mystery,sequel|shootout|drug lord|reboot|death of friend,English|Spanish,US,Shaft (Reboot) Collection,Tim Story,Samuel L. Jackson|Jessie T. Usher|Regina Hall|Alexandra Shipp|Richard Roundtree,Davis Entertainment|New Line Cinema,30000000,21360215,6.535,1831,3.4507
10750,tt0103112,Toy Soldiers,Toy Soldiers,"They've Always been REBELS - TODAY, They Become HEROES.","After federal agents arrest a drug czar and put him on trial, the cartel leader's vicious son storms a prep school and takes its students hostage. They rebel against the armed intruders and try to take back their academy by any means necessary.",1991-04-24,112,R,Action|Adventure|Thriller,high school|hostage-taking|terrorism|preparatory school,English,US,,Daniel Petrie Jr.,Sean Astin|Wil Wheaton|Keith Coogan|Andrew Divoff|R. Lee Ermey,TriStar Pictures|Island World,10000000,15100000,6.5,372,3.1476
1029235,tt22173666,Azrael,Azrael,"Many years after the rapture… Among the survivors, some are driven to renounce their sin of Speech.","In a world where no one speaks, a devout female hunts down a young woman who has escaped her imprisonment. Recaptured by its ruthless leaders, Azrael is due to be sacrificed to pacify an ancient evil deep within the surrounding wilderness.",2024-09-27,86,R,Action|Horror|Thriller,sacrifice|aggressive|ancient evil|azrael,,US,,E.L. Katz,Samara Weaving|Vic Carmen Sonne|Katariina Unt|Peter Christoffersen|Nathan Stewart-Jarrett,C2 Motion Picture Group|Traffic.,12000000,631272,5.91,399,4.1673
376866,tt1619029,Jackie,Jackie,,"An account of the days of First Lady, Jacqueline Kennedy, in the immediate aftermath of John F. Kennedy's assassination in 1963.",2016-12-02,100,R,Drama,"assassination|usa president|widow|john f. kennedy|biography|dallas, texas|president|grief|first lady|kennedy family|john f. kennedy assassination|death of husband|usa history|1960s|jacqueline kennedy",Spanish|English,US,,Pablo Larraín,Natalie Portman|Peter Sarsgaard|Greta Gerwig|Billy Crudup|John Hurt,LD Entertainment|Protozoa Pictures|Fabula|Bliss Media|Wild Bunch|Why Not Productions|Endemol Shine Studios,9000000,13960394,6.458,2417,3.4779
936,tt0057413,The Pink Panther,The Pink Panther,You only live once… so see the Pink Panther twice!!!,"The trademark of The Phantom, a renowned jewel thief, is a glove left at the scene of the crime. Inspector Clouseau, an expert on The Phantom's exploits, feels sure that he knows where The Phantom will strike next and leaves Paris for the Tyrolean Alps, where the famous Lugashi jewel 'The Pink Panther' is going to be. However, he does not know who The Phantom really is, or for that matter who anyone else really is...",1963-12-18,115,PG,Comedy|Crime,slapstick comedy|clouseau|bumbling|clumsiness|police inspector|calm|bumbling cop|farcical|assalto a museu,French|English|Italian|Spanish,US,The Pink Panther (Original) Collection,Blake Edwards,David Niven|Peter Sellers|Claudia Cardinale|Capucine|Robert Wagner,United Artists|The Mirisch Company|Geoffrey Productions,0,10878107,6.841,1155,3.7671
11019,tt0365109,Deep Blue,Deep Blue,,"Deep Blue is a major documentary feature film shot by the BBC Natural History Unit. An epic cinematic rollercoaster ride for all ages, Deep Blue uses amazing footage to tell us the story of our oceans and the life they support.",2003-05-18,83,6,Documentary,fish|sea|diving|whale|deep sea|atlantic ocean|penguin|shark|nature|nature documentary|marine life,English,DE|GB,,Andy Byatt|Alastair Fothergill,Michael Gambon|David Attenborough|Pierce Brosnan|Frank Glaubrecht|Jacques Perrin,Greenlight Media AG|BBC Worldwide|BBC Studios Natural History Unit,5000000,19292500,6.837,83,2.8956
13528,tt0036855,Gaslight,Gaslight,Strange drama of a captive sweetheart!,A newlywed fears she's going mad when strange things start happening at the family mansion.,1944-05-04,114,+13,Thriller|Drama|Mystery|Crime,scotland yard|manipulation|victorian england|psychological abuse|murder|psychological thriller|nervous breakdown|older husband|driven mad|abusive husband|gaslight|domineering husband|sadistic husband|emotional abuse|gaslighting|male gold digger|bluebeard,English,US,,George Cukor,Charles Boyer|Ingrid Bergman|Joseph Cotten|May Whitty|Angela Lansbury,Metro-Goldwyn-Mayer,2068000,0,7.53,556,3.237
