tmdb_id,imdb_id,title,original_title,tagline,overview,release_date,runtime_mins,certification,genres,keywords,spoken_languages,origin_country,collection,director,top_cast,production_companies,budget,revenue,vote_average,vote_count,popularity
12163,tt1125849,The Wrestler,The Wrestler,Love. Pain. Glory.,"Aging wrestler Randy ""The Ram"" Robinson is long past his prime but still ready and rarin' to go on the pro-wrestling circuit. After a particularly brutal beating, however, Randy hangs up his tights, pursues a serious relationship with a long-in-the-tooth stripper, and tries to reconnect with his estranged daughter. But he can't resist the lure of the ring and readies himself for a comeback.",2008-09-07,109,R,Drama|Romance,daughter|new jersey|supermarket|heart attack|redemption|ambition|barbed wire|stripper|steroids|fame|shocking|pro wrestling|reflective|pro wrestlers|absurd|cruel,English,US,,Darren Aronofsky,Mickey Rourke|Marisa Tomei|Evan Rachel Wood|Mark Margolis|Todd Barry,Wild Bunch|Top Rope|Saturn Films|Protozoa Pictures,6000000,44734660,7.538,3954,3.3508
7457,tt0426883,Alpha Dog,Alpha Dog,One crime. 38 witnesses. No way back.,"Johnny Truelove likes to see himself as tough. He's the son of an underworld figure and a drug dealer. Johnny also likes to get tough when things don't go his way. When Jake Mazursky fails to pay up for Johnny, things get worse for the Mazursky family, as Johnny and his 'gang' kidnap Jake's 15 year old brother and hold him hostage.",2006-01-27,118,R,Crime|Drama|Thriller,california|kidnapping|hostage|swimming pool|marijuana|drugs,English,US,,Nick Cassavetes,Emile Hirsch|Bruce Willis|Amanda Seyfried|Justin Timberlake|Shawn Hatosy,A-Mark Entertainment|Universal Pictures|Sidney Kimmel Entertainment|Capitol Films|VIP 2 Medienfonds,9500000,32400000,6.639,1482,3.4853
1623,tt0080474,Brubaker,Brubaker,One man against a cruel system.,The new warden of a small prison farm in Arkansas tries to clean it up of corruption after initially posing as an inmate.,1980-06-20,125,R,Crime|Drama,prison|undercover|liberation of prisoners|arkansas|prison warden|based on true story|prison brutality|abuse|1960s|prison farm|prisoner abuse|prisão|agente infiltrado,English,US,,Stuart Rosenberg,Robert Redford|Yaphet Kotto|Jane Alexander|Murray Hamilton|David Keith,20th Century Fox,9000000,37121708,7.083,509,3.2748
232,tt0086216,Rumble Fish,Rumble Fish,Rusty James can't live up to his brother's reputation. His brother can't live it down.,"Absent-minded street thug Rusty James struggles to live up to his legendary older brother's reputation, and longs for the days of gang warfare.",1983-10-09,94,R,Crime|Drama|Romance,"street gang|pool billiards|gang|thug|tulsa, oklahoma|brother brother relationship|based on young adult novel|dreary",English,US,,Francis Ford Coppola,Matt Dillon|Mickey Rourke|Diane Lane|Dennis Hopper|Diana Scarwid,American Zoetrope|Hotweather Films,10000000,2494480,6.995,749,2.9358
10495,tt0097647,The Karate Kid Part III,The Karate Kid Part III,"First it was teacher to student. Then it was father to son. Now, it's man to man.","Despondent over the closing of his karate school, Cobra Kai teacher John Kreese joins a ruthless businessman and martial artist to get revenge on Daniel and Mr. Miyagi.",1989-06-16,112,PG,Action|Family|Drama|Adventure,martial arts|war veteran|karate|adversary|bullying|sequel|bully|teenage love|martial arts tournament|martial arts training|nostalgic|mentor protégé relationship|bullied|philosophical|inspirational|martial arts contest|rappelling|hopeful|optimistic,English,US,The Karate Kid Collection,John G. Avildsen,Ralph Macchio|Pat Morita|Robyn Lively|Thomas Ian Griffith|Martin Kove,Columbia Pictures|Weintraub International Group|Jerry Weintraub Productions,12500000,38956288,5.929,1788,2.7918
549514,tt8829830,Fatale,Fatale,One mistake can change your life.,"After a wild one-night stand, successful sports agent Derrick Tyler watches his perfect life slowly disappear when he discovers the sexy and mysterious woman he risked everything for is determined police detective Valerie Quinlan who entangles him in her latest investigation. As he desperately tries to put the pieces together, he falls deeper into her trap, risking his family, his career, and even his life.",2020-12-18,102,R,Drama|Thriller,california|husband wife relationship|married couple|investigation|one-night stand|ex husband|murder|betrayal|best friend|las vegas|home invasion|cat and mouse|female detective|cousin relationship|business partner|married man|deadly game|lies|manipulative woman|marital strife|black cinema|business owner|contentious relationship,English,US,,Deon Taylor,Hilary Swank|Michael Ealy|Mike Colter|Damaris Lewis|Tyrin Turner,Hidden Empire Film Group|Summit Entertainment,0,0,6.0,373,3.5326
64494,tt0089539,Malibu Express,Malibu Express,Packing Heat From Texas To Malibu Beach,In this erotic spy tale private eye Cody Abilene teams up with the Contessa Luciana and policewoman Beverly McAfee to infiltrate a mansion and discover who is sending computer secrets to the Russians.,1985-03-01,101,R,Action|Adventure|Comedy|Crime|Mystery,helicopter|assassination|transvestism|car race|boat|blackmail|amateur detective|hawaii|texas|persuasion|breast|explosion|wealthy widow|muscles|bad aim,English,US,"Bullets, Bombs, and Babes Collection",Andy Sidaris,Darby Hinton|Sybil Danning|Art Metrano|Shelley Taylor Morgan|Brett Baxter Clark,Andy Sidaris Company|Malibu Bay Films,500000,0,4.8,73,3.0979
1160164,tt28814949,TAYLOR SWIFT | THE ERAS TOUR,TAYLOR SWIFT | THE ERAS TOUR,It's been a long time coming.,"A concert film documenting Taylor Swift's record-breaking Eras Tour (2023-2024). Filmed during the Los Angeles shows, the film captures the tour's ten acts, each representing a different musical era from Swift's career. The film showcases over 40 songs, elaborate stage productions, and Swift's performance.",2023-10-13,169,PG-13,Music,musician|live performance|pop music|concert film|singer-songwriter|aftercreditsstinger|duringcreditsstinger|amused|cheerful,English,US,,Sam Wrench,Taylor Swift|Mike Meadows|Max Bernstein|Paul Sidoti|Amos Heller,Taylor Swift Productions|Silent House Productions,15000000,261656269,8.207,511,2.8526
203,tt0070379,Mean Streets,Mean Streets,Go to church on Sunday. Go to Hell on Monday.,"A small-time hood must choose from among love, friendship and the chance to rise within the mob.",1973-10-14,111,R,Drama|Crime,"secret love|italian american|gangster|protection money|epilepsy|redemption|money|little italy|catholicism|manhattan, new york city|grand",English|Italian,US,,Martin Scorsese,Robert De Niro|Harvey Keitel|David Proval|Amy Robinson|Richard Romanus,Taplin-Perry-Scorsese Productions,500000,3000000,7.055,2268,2.8471
1051891,tt23778968,Thelma,Thelma,Revenge has never been sweeter.,"When 93-year-old Thelma Post gets duped by a phone scammer pretending to be her grandson, she sets out on a treacherous quest across the city to reclaim what was taken from her.",2024-06-21,98,PG-13,Action|Comedy|Adventure,"widow|scam|female protagonist|los angeles, california|scooter|duringcreditsstinger|old-age home|grandmother grandson relationship|elderly woman|old age|self justice|absurd|sentimental|missing grandmother|amused|overbearing family|telephone scam",English,US,,Josh Margolin,June Squibb|Fred Hechinger|Richard Roundtree|Parker Posey|Clark Gregg,Zurich Avenue|Invention Studios|Bandwagon,5000000,12537071,6.843,383,3.451
1049,tt0108185,Sommersby,Sommersby,She knew his face. His touch. His voice. She knew everything about him ... But the truth.,"Set in the South just after the US Civil War, Laurel Sommersby is just managing to work the farm without her husband, believed killed in battle. By all accounts, Jack Sommersby was not a pleasant man, thus when he suddenly returns, Laurel has mixed emotions. It appears that Jack has changed a great deal, leading some people to believe that this is not actually Jack but an imposter. Laurel herself is unsure, but willing to take the man into her home, and perhaps later into her heart.",1993-02-05,109,PG-13,Drama|Thriller|Mystery|Romance,husband wife relationship|court case|war veteran|ku klux klan|southern usa|village life|return|peasant|suspicion of murder|gallows|violent husband|death sentence|agriculture|racial segregation|based on true story|look-alike|impostor|hanging|post civil war|soldier's wife|reconstruction era,English,US,,Jon Amiel,Jodie Foster|Richard Gere|Bill Pullman|James Earl Jones|Lanny Flaherty,Regency Enterprises|Alcor Films|Le Studio Canal+,30000000,140081992,6.34,420,3.0677
11387,tt0059399,Lord Jim,Lord Jim,Lord Jim blasts the screen with breathless adventure!,"After being discredited as a coward, a 19th century seaman lives for only one purpose: to redeem himself.  Preserved by the Academy Film Archive in partnership with Sony Pictures Entertainment in 2000.",1965-02-15,154,12,Adventure|Drama|Romance,"ship|based on novel or book|redemption|cowardice|angkor wat|scandal|honor|seaman|storm at sea|shame|port|19th century|java, indonesia|seafarer",English,US|GB,,Richard Brooks,Peter O'Toole|James Mason|Curd Jürgens|Eli Wallach|Jack Hawkins,Columbia British Productions|Columbia Pictures|Keep Films,0,0,6.8,81,3.688
11639,tt0083791,The Dark Crystal,The Dark Crystal,"Another world, another time... in the age of wonder.","On another planet in the distant past, a Gelfling embarks on a quest to find the missing shard of a magical crystal and restore order to his world, before the grotesque race of Skeksis find and use the crystal for evil.",1982-12-17,93,PG,Adventure|Family|Fantasy,race against time|mission|liberation|castle|villain|mythical creature|puppetry|creature|fantasy world|crystal|good versus evil|bizarre creatures|complicated|melodramatic|ominous,English,US|GB,,Frank Oz|Jim Henson,Jim Henson|Kathryn Mullen|Frank Oz|Dave Goelz|Steve Whitmire,ITC Entertainment|Henson Associates,15000000,44626631,7.128,1236,3.0116
616747,tt1695843,Haunted Mansion,Haunted Mansion,Home is where the haunt is.,A woman and her son enlist a motley crew of so-called spiritual experts to help rid their home of supernatural squatters.,2023-07-26,123,PG-13,Comedy|Drama|Fantasy,magic|haunted house|grief|ghost|nostalgic|haunted mansion|based on theme park ride,English,US,,Justin Simien,Rosario Dawson|Chase W. Dillon|LaKeith Stanfield|Owen Wilson|Tiffany Haddish,Walt Disney Pictures|Rideback,157800000,117449790,6.427,1212,3.2687
73935,tt1545106,Vamps,Vamps,Nice girls suck.,The modern-day story focuses on two beautiful young vampires who are living the good nightlife in New York until love enters the picture and each has to make a choice that will jeopardize their immortality.,2012-08-25,93,PG-13,Comedy|Romance|Horror,new york city|vampire|affectation|female friendship|love|woman director|nightlife|absurd|compassionate,English,US,,Amy Heckerling,Alicia Silverstone|Krysten Ritter|Dan Stevens|Richard Lewis|Wallace Shawn,Lucky Monkey Pictures|Red Hour,16000000,92748,5.3,297,3.5641
22201,tt0050468,Gunfight at the O.K. Corral,Gunfight at the O.K. Corral,The Wildest Gunfight in the History of the West!,Lawman Wyatt Earp and outlaw Doc Holliday form an unlikely alliance which culminates in their participation in the legendary Gunfight at the O.K. Corral.,1957-05-30,122,NR,Western|Drama,arizona|based on true story|historical figure|u.s. marshal|wyatt earp|doc holliday|gun battle|shootout|gunfight|tuberculosis|tombstone arizona|19th century|ok corral|two guns belt,English,US,,John Sturges,Burt Lancaster|Kirk Douglas|Jo Van Fleet|Rhonda Fleming|John Ireland,Wallis-Hazen Inc.|Hal Wallis Productions|Paramount Pictures,0,11750000,7.011,373,3.1213
487680,tt5822564,The Kitchen,The Kitchen,It's not a man's world anymore.,"The mobster husbands of three 1978 Hell's Kitchen housewives are sent to prison by the FBI. Left with little but a sharp ax to grind, the ladies take the Irish mafia's matters into their own hands — proving unexpectedly adept at everything from running the rackets to taking out the competition… literally.",2019-08-08,103,R,Action|Crime|Drama,new york city|1970s|based on comic|irish mob|woman director,English,US,,Andrea Berloff,Melissa McCarthy|Tiffany Haddish|Elisabeth Moss|Domhnall Gleeson|Bill Camp,New Line Cinema|Michael De Luca Productions|DC Vertigo|Bron Studios,38000000,16000000,6.107,723,2.9149
44603,tt1212419,Hereafter,Hereafter,Touched by death. Changed by life.,"Three people — a blue-collar American, a French journalist and a London school boy — are touched by death in different ways.",2010-10-22,129,PG-13,Drama|Fantasy,journalist|afterlife|tsunami,English|French,US,,Clint Eastwood,Matt Damon|Cécile de France|Bryce Dallas Howard|Thierry Neuvic|Cyndi Mayo-Akeo,Warner Bros. Pictures|Amblin Entertainment|The Kennedy/Marshall Company|Malpaso Productions,50000000,107000000,6.136,1790,2.7288
65086,tt1596365,The Woman in Black,The Woman in Black,What did they see?,"The story follows a young lawyer, Arthur Kipps, who is ordered to travel to a remote village and sort out a recently deceased client’s papers. As he works alone in the client’s isolated house, Kipps begins to uncover tragic secrets, his unease growing when he glimpses a mysterious woman dressed only in black. Receiving only silence from the locals, Kipps is forced to uncover the true identity of the Woman in Black on his own, leading to a desperate race against time when he discovers her true identity.",2012-02-03,95,PG-13,Drama|Horror|Thriller,"london, england|remake|revenge|lawyer|dead child|photograph|gothic horror|period drama|super power|estate|ghost",English,GB,The Woman in Black Collection,James Watkins,Daniel Radcliffe|Ciarán Hinds|Janet McTeer|Liz White|Tim McMullan,Hammer Film Productions|Alliance Films|Talisman Films|UK Film Council,32000000,129000000,6.141,3628,3.0267
369557,tt3544112,Sing Street,Sing Street,Boy meets girl. Girl unimpressed. Boy starts band.,A boy growing up in Dublin during the 1980s escapes his strained family life by starting a band to impress the mysterious girl he likes.,2016-03-11,105,PG-13,Romance|Drama|Music|Comedy,"friendship|london, england|sibling relationship|dublin, ireland|music video|prom|school|singing|ireland|divorce|family|teenage boy|bullied|1980s|loving|irreverent|adoring|amused",English,IE,,John Carney,Ferdia Walsh-Peelo|Lucy Boynton|Jack Reynor|Ben Carolan|Mark McKenna,Likely Story|FilmWave|Distressed Films|Cosmo Films|PalmStar Media|Fís Éireann/Screen Ireland|Merkel Media,4000000,13624522,7.9,2426,2.7775
22824,tt1220198,The Fourth Kind,The Fourth Kind,There are four kinds of alien encounters. The fourth kind is abduction.,"Since the 1960s, a disproportionate number of the population in and around Nome, Alaska, have gone missing. Despite FBI investigations, the disappearances remain a mystery. Dr. Abigail Tyler, a psychologist, may be on the verge of blowing the unsolved cases wide open when, during the course of treating her patients, she finds evidence of alien abductions.",2009-11-05,98,PG-13,Mystery|Science Fiction|Thriller,"sibling relationship|investigation|wheelchair|hypnosis|based on true story|alien|cover-up|ufo|alaska|disappearance|hospital|alien abduction|patient|psychotherapy|found footage|nome alaska|faked footage|audio cassette|anchorage, alaska|police fake|duringcreditsstinger|aliens|pseudo-documentary",English,US,,Olatunde Osunsanmi,Milla Jovovich|Elias Koteas|Will Patton|Hakeem Kae-Kazim|Corey Johnson,Universal Pictures|Gold Circle Films|Chambara Pictures|Dead Crow Productions|Saga Film|Mandate International,10000000,47709193,6.3,1851,3.1272
71880,tt0810913,Jack and Jill,Jack and Jill,His twin sister is coming for the holidays... ...and it ain't pretty.,"Jack Sadelstein, a successful advertising executive in Los Angeles with a beautiful wife and kids, dreads one event each year: the Thanksgiving visit of his twin sister Jill. Jill's neediness and passive-aggressiveness is maddening to Jack, turning his normally tranquil life upside down.",2011-11-11,91,PG,Comedy|Family,"thanksgiving|los angeles, california|family|celebration|duringcreditsstinger",English,US,,Dennis Dugan,Adam Sandler|Al Pacino|Katie Holmes|Elodie Tougne|Rohan Chand,Broken Road Productions|Columbia Pictures|Happy Madison Productions,79000000,149700000,4.392,2203,3.422
11281,tt0082495,Halloween II,Halloween II,More of the night he came home.,"After failing to kill stubborn survivor Laurie and taking a bullet or six from former psychiatrist Dr. Sam Loomis, Michael Myers has followed Laurie to the Haddonfield Memorial Hospital, where she's been admitted for Myers' attempt on her life. The institution proves to be particularly suited to serial killers, however, as Myers cuts, stabs and slashes his way through hospital staff to reach his favorite victim.",1981-10-30,92,R,Horror|Thriller,mask|sheriff|halloween|sequel|serial killer|hospital|killing spree|holiday horror,English,US,Halloween Collection,Rick Rosenthal,Jamie Lee Curtis|Donald Pleasence|Charles Cyphers|Jeffrey Kramer|Lance Guest,The De Laurentiis Company,2500000,25533818,6.6,2212,3.4999
9545,tt0108171,Sniper,Sniper,One Shot. One Kill. No Exceptions.,Tough guy Thomas Beckett is a US Marine working in the Panamanian jungle. His job is to seek out rebels and remove them using his sniper skills. Beckett is notorious for losing his partners on such missions. This time he's accompanied by crack marksman Richard Miller.,1993-01-29,98,R,Action|Drama|Thriller,sniper|panama|fistfight|waterfall|gun battle|marine|jungle|sniper rifle|political assassination|central america|u.s. marine|dog tag|marksman|surrounded|military uniform|surrender|camoflage uniform|one bullet|covert mission|covert assassin|rescue helicopter|unlikely partners,English,US,Sniper Collection,Luis Llosa,Tom Berenger|Billy Zane|J. T. Walsh|Aden Young|Kenneth Radley,TriStar Pictures|Iguana Producciones|Baltimore Pictures|Sniper Productions,0,18994652,6.192,458,3.3334
11873,tt0090863,The Color of Money,The Color of Money,The Hustler isn't what he used to be. But he has the next best thing. A kid who is.,"Former pool hustler ""Fast Eddie"" Felson decides he wants to return to the game by taking a pupil. He meets talented but green Vincent Lauria and proposes a partnership. As they tour pool halls, Eddie teaches Vincent the tricks of scamming, but he eventually grows frustrated with Vincent's showboat antics, leading to an argument and a falling-out. Eddie takes up playing again and soon crosses paths with Vincent as an opponent.",1986-10-17,119,R,Drama,sports|pool billiards|hustler|talent|inspirational|understated,English|Spanish,US,The Hustler Collection,Martin Scorsese,Paul Newman|Tom Cruise|Mary Elizabeth Mastrantonio|Helen Shaver|John Turturro,Touchstone Pictures|Silver Screen Partners II,13800000,52293982,6.851,1486,3.1757
360606,tt4456850,Adventures in Babysitting,Adventures in Babysitting,,"Two teen rival babysitters, Jenny and Lola, team up to hunt down one of their kids who accidentally ran away into the big city without any supervision.",2016-06-24,95,G,Comedy|Family|Adventure|TV Movie,babysitter|remake,English,US,,John Schultz,Sabrina Carpenter|Sofia Carson|Nikki Hahn|Mallory James Mahoney|Max Gecowets,"Bad Angels Productions, Ltd.",9000000,0,7.24,435,3.5882
308504,tt2493486,Last Knights,Last Knights,,"When an evil emperor executes their leader, his band of knights – bound by duty and honour – embarks on a journey of vengeance that will not come to an end until they've destroyed their mortal foe.",2015-04-03,115,R,Action|Adventure,loyalty|emperor|castle|sword fight|revenge|honor|knight|master|medieval|warrior|corrupt,English,GB|US,,Kazuaki Kiriya,Clive Owen|Morgan Freeman|Aksel Hennie|Shohreh Aghdashloo|James Babson,Luka Productions|Route One Entertainment|Sovik Global Contents Fund|DMM.com|Union Investment Partners|CJ Entertainment|Channel A|Czech Anglo Pictures|Lotte Entertainment|Maeil Broadcasting Network|Arclight Films|Lionsgate,40000000,3643591,6.408,1141,3.0609
11412,tt0116908,The Long Kiss Goodnight,The Long Kiss Goodnight,What's forgotten is not always gone.,"Samantha Caine is a small-town schoolteacher and mom with no memory of her life before washing up on a beach eight years ago. After a car accident and a violent home invasion trigger flashes of her past, she discovers she used to be a deadly CIA assassin. Teaming up with a wisecracking private investigator, Samantha must return to her old ways to take down the people who tried to erase her.",1996-10-11,121,R,Crime|Action|Mystery|Thriller,martial arts|amnesia|assassination|strong woman|escape|chase|hostage|spy|new identity|dark comedy|teacher|beautiful woman|shootout|female protagonist|gunfight|terrorism|single mother|government assassin|timebomb|candlelight vigil|rogue agent|woman agent|christmas|ex-cia agent|action hero|amnesiac|christmas parade|assassination team|dramatic|gun death|bold,English,US,,Renny Harlin,Geena Davis|Samuel L. Jackson|Yvonne Zima|Craig Bierko|Tom Amandes,The Steve Tisch Company|New Line Cinema|Forge,65000000,89456761,6.583,1321,3.3361
451,tt0113627,Leaving Las Vegas,Leaving Las Vegas,I love you... The way you are.,"Ben Sanderson, an alcoholic Hollywood screenwriter who lost everything because of his drinking, arrives in Las Vegas to drink himself to death. There, he meets and forms an uneasy friendship and non-interference pact with prostitute Sera.",1995-10-27,111,R,Drama|Romance,"hotel room|dying and death|individual|prostitute|lovesickness|rage and hate|casino|unsociability|alcohol|love at first sight|movie business|screenwriter|alcoholism|los angeles, california|las vegas|alcohol abuse|dramatic|depressing|tragic",English|Italian|Russian,US,,Mike Figgis,Nicolas Cage|Elisabeth Shue|Julian Sands|Richard Lewis|Steven Weber,Initial Productions|Lumière Pictures,3600000,49800000,7.249,1614,3.0763
553087,tt11790674,Oslo,Oslo,How do enemies find common ground?,"The true story of negotiations between implacable enemies — the secret back-channel talks, unlikely friendships and quiet heroics of a small but committed group of Israelis, Palestinians and one Norwegian couple that led to the 1993 Oslo Peace Accords.",2021-05-29,118,14,TV Movie|Drama|History,based on true story|based on play or musical|1990s,Arabic|English|Hebrew,US,,Bartlett Sher,Ruth Wilson|Andrew Scott|Salim Daw|Waleed Zuaiter|Jeff Wilbusch,DreamWorks Pictures|Bold Films|Marc Platt Productions|HBO Films|SRO Productions,0,0,6.5,105,3.0559
1134048,tt15220066,Marshmallow,Marshmallow,Question everything.,"At a secluded summer camp, timid and introverted 12-year-old Morgan is thrust into a waking nightmare when a once-fabled campfire tale becomes real. As a mysterious figure descends upon the camp, Morgan and his newfound friends must embark on a treacherous journey and uncover a sinister reality buried beneath the surface.",2025-04-11,93,NR,Horror|Science Fiction,summer camp|coming of age|camp|slasher|horror|sci-fi horror,English,US,Marshmallow Collection,Daniel DelPurgatorio,Pierson Fodé|Corbin Bernsen|Giorgia Whigham|Alysia Reiner|Paul Soter,Hemlock Circle Productions|The Warner Davis Company,0,0,6.065,77,3.8883
526702,tt8484160,Black Beauty,Black Beauty,Find your way home.,"Born free in the American West, Black Beauty is a horse rounded up and brought to Birtwick Stables, where she meets spirited teenager Jo Green. The two forge a bond that carries Beauty through the different chapters, challenges and adventures.",2020-11-27,110,PG,Drama,narration|teenager horse relationship,English|Spanish,US,,Ashley Avis,Kate Winslet|Mackenzie Foy|Iain Glen|Calam Lynch|Claire Forlani,Constantin Film|JB Pictures|Spark Productions,0,0,7.996,351,3.4847
370097,tt4525270,Stormageddon,Stormageddon,The Echelon Disaster,"What happens when you ask the most powerful computer program, run by the most powerful computers, to follow, listen and predict human behavior? The program learns, becomes sentient and begins to behave like a human. When a master computer program, Echelon, takes over America's entire online system, our country is threatened to be brought to its knees. Hacking into DARPA, Echelon gains the ability to manipulate the weather, create earthquakes, and cause a level of destruction unlike anything the country could ever imagine. But how do you stop a computer program when it has control over any and every defense you have?",2015-11-18,90,12,Action|Drama|Thriller|Science Fiction,dystopia,English,US,,Nick Lyon,John Hennigan|Eve Mauro|Joseph Gatt|Robert Blanche|Ricco Ross,Tiberius Film,0,0,6.1,96,2.8748
9542,tt0091209,The Hitcher,The Hitcher,The terror starts the moment he stops.,"On a stormy night, young Jim, who transports a luxury car from Chicago to California to deliver it to its owner, feeling tired and sleepy, picks up a mysterious hitchhiker, who has appeared out of nowhere, thinking that a good conversation will help him not to fall asleep. He will have enough time to deeply regret such an unmeditated decision.",1986-01-17,98,R,Horror|Action|Thriller,cop-killer|sadism|gun|gas station|psychopath|falsely accused|mass murder|paranoia|highway|road trip|serial killer|man hunt|hitchhiker|desert|road movie|aggressive|truck stop|intense|bewildered|mean spirited,English,US,The Hitcher Collection,Robert Harmon,Rutger Hauer|C. Thomas Howell|Jeffrey DeMunn|Billy Green Bush|John M. Jackson,Feldman/Meeker Productions,6000000,5844868,6.96,1031,2.9971
